<?xml version="1.0" encoding="UTF-8" ?>
<pzl:puzzle width="6"
            height="6"
            difficulty="3.5"
            creationDate="2017-09-28"
            xmlns="http://vstrimaitis.github.io/puzzle"
            xmlns:pzl="http://vstrimaitis.github.io/puzzle"
            xmlns:xsi ="http://www.w3.org/2001/XMLSchema-instance"
            xsi:schemaLocation="http://vstrimaitis.github.io/puzzle wordSearchPuzzle.xsd"
>
  <description>
    This is a <h>very</h> nice description.
  </description>
  <resultHistory>
    16 15 20 60 404
  </resultHistory>
  <pzl:words>
    <pzl:word id="0">JAVASCRIPT</pzl:word>
    <pzl:word id="1">XPATH</pzl:word>
    <pzl:word id="2">JSON</pzl:word>
    <pzl:word id="3">SCHEMA</pzl:word>
    <pzl:word id="4">HTML</pzl:word>
    <pzl:word id="5">CSS</pzl:word>
    <pzl:word id="6">INTERNETAS</pzl:word>
    <pzl:word id="7">WIFI</pzl:word>
  </pzl:words>
  <pzl:grid>
    <pzl:row>
      <pzl:col>J</pzl:col>
      <pzl:col>R</pzl:col>
      <pzl:col>I</pzl:col>
      <pzl:col>T</pzl:col>
      <pzl:col>N</pzl:col>
      <pzl:col>T</pzl:col>
      <pzl:colUnknown>?</pzl:colUnknown>
    </pzl:row>
    <pzl:row>
      <pzl:col>A</pzl:col>
      <pzl:col>C</pzl:col>
      <pzl:col>P</pzl:col>
      <pzl:col>C</pzl:col>
      <pzl:col>I</pzl:col>
      <pzl:col>M</pzl:col>
      <pzl:col>E</pzl:col>
    </pzl:row>
    <pzl:row>
      <pzl:col>V</pzl:col>
      <pzl:col>S</pzl:col>
      <pzl:col>L</pzl:col>
      <pzl:col>S</pzl:col>
      <pzl:col>E</pzl:col>
      <pzl:col>R</pzl:col>
      <pzl:col>N</pzl:col>
    </pzl:row>
    <pzl:row>
      <pzl:col>A</pzl:col>
      <pzl:col>Y</pzl:col>
      <pzl:col>L</pzl:col>
      <pzl:col>H</pzl:col>
      <pzl:col>S</pzl:col>
      <pzl:col>E</pzl:col>
      <pzl:col>T</pzl:col>
    </pzl:row>
    <pzl:row>
      <pzl:col>X</pzl:col>
      <pzl:col>H</pzl:col>
      <pzl:col>C</pzl:col>
      <pzl:col>M</pzl:col>
      <pzl:col>W</pzl:col>
      <pzl:col>I</pzl:col>
      <pzl:col>A</pzl:col>
    </pzl:row>
    <pzl:row>
      <pzl:col>P</pzl:col>
      <pzl:col>S</pzl:col>
      <pzl:col>T</pzl:col>
      <pzl:col>X</pzl:col>
      <pzl:col>I</pzl:col>
      <pzl:col>F</pzl:col>
      <pzl:col>S</pzl:col>
    </pzl:row>
    <pzl:row>
      <pzl:col>A</pzl:col>
      <pzl:col>T</pzl:col>
      <pzl:col>H</pzl:col>
      <pzl:col>J</pzl:col>
      <pzl:col>S</pzl:col>
      <pzl:col>O</pzl:col>
      <pzl:col>N</pzl:col>
    </pzl:row>
  </pzl:grid>
  <solution>
    <word id="0">
      <start row="0" col="0"/>
      <end row="0" col="3"/>
      <turns>
        <turn row="3" col="0"/>
        <turn row="2" col="1"/>
        <turn row="0" col="1"/>
        <turn row="0" col="2"/>
        <turn row="1" col="2"/>
      </turns>
    </word>
    <word id="1">
      <start row="4" col="0"/>
      <end row="6" col="2"/>
      <turns>
        <turn row="6" col="0"/>
      </turns>
    </word>
    <word id="2">
      <start row="6" col="3"/>
      <end row="6" col="6"/>
      <turns/>
    </word>
    <word id="3">
      <start row="5" col="1"/>
      <end row="0" col="6"/>
      <turns/>
    </word>
    <word id="4">
      <start row="4" col="1"/>
      <end row="3" col="2"/>
      <turns>
        <turn row="5" col="2"/>
        <turn row="4" col="3"/>
      </turns>
    </word>
    <word id="5">
      <start row="1" col="3"/>
      <end row="3" col="4"/>
      <turns>
        <turn row="2" col="3"/>
      </turns>
    </word>
    <word id="6">
      <start row="1" col="4"/>
      <end row="5" col="6"/>
      <turns>
        <turn row="0" col="4"/>
        <turn row="0" col="5"/>
        <turn row="1" col="6"/>
        <turn row="2" col="5"/>
        <turn row="2" col="6"/>
        <turn row="3" col="5"/>
        <turn row="3" col="6"/>
      </turns>
    </word>
    <word id="7">
      <start row="4" col="4"/>
      <end row="5" col="4"/>
      <turns>
        <turn row="4" col="5"/>
        <turn row="5" col="5"/>
      </turns>
    </word>
  </solution>
</pzl:puzzle>